{
  "$schema": "https://json-schema.org/draft/2020-12/schema",
  "$id": "https://kata.dev/schemas/judge-result.schema.json",
  "title": "Kata Judge Result",
  "type": "object",
  "required": [
    "taskId",
    "result",
    "acceptance"
  ],
  "additionalProperties": false,
  "properties": {
    "taskId": {
      "type": "string",
      "minLength": 1
    },
    "result": {
      "type": "string",
      "enum": [
        "PASS",
        "FAIL"
      ]
    },
    "diffHash": {
      "type": "string",
      "pattern": "^[a-fA-F0-9]{64}$"
    },
    "revisionId": {
      "type": "string",
      "minLength": 1
    },
    "subjectRevision": {
      "description": "The declared ledger question this Judge record answered; absent on legacy records.",
      "type": "string",
      "minLength": 1
    },
    "manifestHash": {
      "type": "string"
    },
    "codeManifestHash": {
      "description": "Content identity of the revision's code paths only (C2). Stamped beside manifestHash so a code-scoped verdict can outlive a governance-text edit; absent when the split cannot be derived, in which case a code-scoped binding refuses to match.",
      "type": "string"
    },
    "governanceManifestHash": {
      "description": "The governance-text surface at the time of this verdict (§22/§24). A text-only edit expires what this surface was verified for, and nothing else.",
      "type": "string"
    },
    "instrumentManifestHash": {
      "description": "The declared-instrument surface at the time of this verdict (§24.4). Editing a declared instrument expires the instrument surface only — not the pass about the deliverable.",
      "type": "string"
    },
    "candidateFreezeSha256": {
      "description": "The frozen candidate this verdict answered (§7.4). Stamped beside the manifest so the conclusion binds to the reviewed content and semantic contract rather than to the declared owned paths, which cannot see a change committed outside the declaration.",
      "type": "string"
    },
    "dependencyIdentity": {
      "description": "The dependency identity this verdict was certified under (§6.2): the protocol version plus, for each blocking edge, its id, the corrective task's accepted revision and the digest of that task's content actually present in this tree. Absent on a verdict written before the edge existed, which is why a reader treats an unbound verdict as needing re-validation rather than as bound. Deliberately separate from the content identity: `revisionId`/`manifestHash` describe the code, and a change to either must not be faked by rewriting the other.",
      "type": "string"
    },
    "acceptance": {
      "type": "array",
      "minItems": 1,
      "items": {
        "type": "object",
        "required": [
          "id",
          "result"
        ],
        "additionalProperties": false,
        "properties": {
          "id": {
            "type": "string",
            "pattern": "^AC-[0-9]+$"
          },
          "result": {
            "type": "string",
            "enum": [
              "PASS",
              "FAIL"
            ]
          },
          "evidenceIds": {
            "type": "array",
            "items": {
              "type": "string",
              "minLength": 1
            }
          },
          "repairScope": {
            "type": "string"
          },
          "repairOwner": {
            "type": "string",
            "enum": [
              "build"
            ]
          }
        }
      }
    },
    "evidenceIds": {
      "type": "array",
      "items": {
        "type": "string",
        "minLength": 1
      }
    }
  }
}
